{
  "manifest": {
    "entry": "dist/index.html",
    "contributes": {
      "views": [
        {
          "title": "Notes",
          "id": "main"
        }
      ]
    },
    "optional": {},
    "permissions": {
      "network": [],
      "native": false,
      "filesystem": []
    },
    "id": "io.github.example.notes",
    "license": "MIT",
    "description": "Notes fixture",
    "version": "0.1.0",
    "manifestVersion": 1,
    "activation": "view",
    "name": "Notes",
    "engines": {
      "aplg": "^1.0.0"
    },
    "requires": {}
  },
  "assetUrl": "http://127.0.0.1:43172/plugin/index.html",
  "info": {
    "apiVersion": "1.0.0",
    "protocol": "aplg/1",
    "plugin": {
      "id": "io.github.example.notes",
      "version": "0.1.0",
      "packageSha256": "aaaaaaaaaaaaaaaaaaaaaaaaaaaaaaaaaaaaaaaaaaaaaaaaaaaaaaaaaaaaaaaa"
    },
    "capabilities": {},
    "limits": {
      "fileChunkBytes": 262144,
      "controlBytes": 1048576,
      "fileTransfers": 2,
      "fileBytes": 8388608
    }
  },
  "sessionId": "session-a"
}
